{
  "schema_version": 1,
  "request_id": "6fd31d31-e8d9-4ac8-9f65-b7ae97976ac2",
  "command": "create_task",
  "actor": {
    "type": "hermes",
    "id": "platform-orchestrator"
  },
  "task_id": null,
  "issued_at": "2026-09-01T16:00:00Z",
  "idempotency_key": "fixture-create-task-1",
  "payload": {
    "title": "Update fixture file",
    "worker_class": "shell",
    "requires_review": true
  }
}
